{
  "body_state_sha256": "c7a7ac08a93afdc2a3fe6eb27a555ecb3d3de833d3e7917a01ff04a483f4b1f9",
  "calibration_sha256": "c94919d7f2ce44ff1d9768c9cde0cc742caccf0147893d8fc1b312e61a09e5ce",
  "capture_sha256": "20b9dba1ad573ab771a59553f3f05f79476221b7e268454a19949b00024f564b",
  "confidence": 1,
  "content_sha256": "242880b6adb2cc11dccd6cf316fa00767f3d93683fc842e8ae6b26d3e034117e",
  "correspondences": [
    {
      "canonical": {
        "barycentric": [
          0.2,
          0.3,
          0.5
        ],
        "face_index": 1200,
        "topology_sha256": "e0ca7ee25dc0b4c8d841bb2626e364bb88b7af7fae037e30854728842e320a18"
      },
      "error_m": 1e-05,
      "observed_xyz_m": [
        0.4,
        0,
        0.2
      ]
    }
  ],
  "covariance": [
    0,
    0,
    0,
    0,
    0,
    0,
    0,
    0,
    0,
    0,
    0,
    0,
    0,
    0,
    0,
    0,
    0,
    0,
    0,
    0,
    0,
    0,
    0,
    0,
    0,
    0,
    0,
    0,
    0,
    0,
    0,
    0,
    0,
    0,
    0,
    0
  ],
  "measured_surface_sha256": "93befe916c6fef5af853976cd7c2c2a8b7ded088b5d530cc0ccdaaf50ab681c9",
  "method": "synthetic-identity",
  "observed_patch_from_body": [
    [
      1,
      0,
      0,
      0
    ],
    [
      0,
      1,
      0,
      0
    ],
    [
      0,
      0,
      1,
      0
    ],
    [
      0,
      0,
      0,
      1
    ]
  ],
  "provenance": {
    "created_utc": "2026-09-04T01:09:37Z",
    "producer": "tatbot-human-representation-fixture",
    "source_sha256": "29c9c30e0604515ced98b3d14fd88751a8f8e4b9bc69d483a67a257c14ab79fb",
    "version": "1"
  },
  "schema": "tatbot.surface-registration/1",
  "source_frame": "body",
  "supported_cells": [
    0,
    1,
    2,
    3
  ],
  "target_frame": "observed_patch"
}
